{
  "audience": "仓库维护者",
  "decision": "核验结构而非签署视觉",
  "tension": "同任务公平测量",
  "slides": [
    {
      "id": "s01",
      "title": "架构简单，判断不能简单",
      "content": "ENGINEERING × ART DIRECTION / 2026.10 01 架构简单，\n判断不能简单。  删掉重复劳动，保留真实证据。 仓库审计样稿 · 可编辑对象 · 目标 PowerPoint 尚待验收 来源：2ec0b0e 基线与本工作区改动；本文是审计展示，不是商业预测。",
      "asset": "none"
    },
    {
      "id": "s02",
      "title": "测试资产链",
      "content": "01 / 关系先于图形 02 来源：benchmark/holdout.json · H01；60% / 40% 为合成语义案例，非临床结果。 图像是插图，\n不是事实证词。 原始合成测试图\n用于资产绑定与裁切验证 ",
      "asset": "required",
      "asset_role": "background",
      "asset_source": {
        "kind": "original",
        "path": "/home/user/ppt-visual-art-director-os/audit/performance/image15-3-before/fixture.png",
        "source": "Original synthetic audit illustration; not evidence"
      }
    },
    {
      "id": "s03",
      "title": "职责并列不是时间线",
      "content": "02 / 方向只来自明确关系 03 职责并列，\n不是先后顺序。 青禾组 负责 质量测试  澄海组 负责 项目交付 没有已知上下级，就不补汇报线；没有时间轴，就不造流程。 来源：显式关系回归测试；此页为合成组织关系示例，不代表实际组织。",
      "asset": "none"
    },
    {
      "id": "s04",
      "title": "新边界案例通过由7增至12",
      "content": "03 / 判断基准，不是视觉评分 04 五个误判被消除。\n视觉质量仍需另验。  12/12 固定关系不变式\n不是独立盲评\n不是跨行业质量证明 来源：audit/holdout-{before,after}.json；案例预先写定，修复后转为回归集。",
      "asset": "none"
    },
    {
      "id": "s05",
      "title": "调用链不增加模型或新模块",
      "content": "04 / 一次判断，下游复用 05 保持一条生产链。 THINK BUILD VERIFY 主张与证据\n保留未知关系 原生文字与图表\n作者决定几何 硬门与字节凭证\n不代替视觉签署 删除不可靠的隐式缓存；复用显式快照与已验摘要。 来源：scripts/vao.py · plan / check；架构与判断原则见 SKILL.md。",
      "asset": "none"
    },
    {
      "id": "s06",
      "title": "数字与单位绑定不等于真实排版通过",
      "content": "05 / 中文排版必须落到成品 06 186 公里，\n不能在单位前断开。 186 公里 不断行空格已写入原生文字；中文字体角色已绑定。 真实断行、字体回退与投影可读性，须在目标 PowerPoint 检查。 来源：混排回归测试与 PPTX XML；本页 ghost 只提供结构预览。",
      "asset": "none"
    },
    {
      "id": "s07",
      "title": "保留目标软件验收",
      "content": "06 / 交付不能越过证据 07 代码可以通过。\n作品必须被看见。  下一步：打开、编辑、另存，再重开。 目标 PowerPoint 未验证 · 独立视觉盲评未开展 交付边界：结构 PASS 不等于视觉终验；没有真实评审，不填写虚构评分。",
      "asset": "none"
    },
    {
      "id": "s08",
      "title": "架构简单，判断不能简单",
      "content": "ENGINEERING × ART DIRECTION / 2026.10 01 架构简单，\n判断不能简单。  删掉重复劳动，保留真实证据。 仓库审计样稿 · 可编辑对象 · 目标 PowerPoint 尚待验收 来源：2ec0b0e 基线与本工作区改动；本文是审计展示，不是商业预测。",
      "asset": "none"
    },
    {
      "id": "s09",
      "title": "相加为100不是共同分母",
      "content": "01 / 关系先于图形 02 相加为 100，\n不等于同一个整体。 60% 缓解率 40% 不良反应发生率  同一患者可同时满足两者。先问事件是否互斥，再决定能否画饼图。 来源：benchmark/holdout.json · H01；60% / 40% 为合成语义案例，非临床结果。",
      "asset": "none"
    },
    {
      "id": "s10",
      "title": "职责并列不是时间线",
      "content": "02 / 方向只来自明确关系 03 职责并列，\n不是先后顺序。 青禾组 负责 质量测试  澄海组 负责 项目交付 没有已知上下级，就不补汇报线；没有时间轴，就不造流程。 来源：显式关系回归测试；此页为合成组织关系示例，不代表实际组织。",
      "asset": "none"
    },
    {
      "id": "s11",
      "title": "新边界案例通过由7增至12",
      "content": "03 / 判断基准，不是视觉评分 04 五个误判被消除。\n视觉质量仍需另验。  12/12 固定关系不变式\n不是独立盲评\n不是跨行业质量证明 来源：audit/holdout-{before,after}.json；案例预先写定，修复后转为回归集。",
      "asset": "none"
    },
    {
      "id": "s12",
      "title": "调用链不增加模型或新模块",
      "content": "04 / 一次判断，下游复用 05 保持一条生产链。 THINK BUILD VERIFY 主张与证据\n保留未知关系 原生文字与图表\n作者决定几何 硬门与字节凭证\n不代替视觉签署 删除不可靠的隐式缓存；复用显式快照与已验摘要。 来源：scripts/vao.py · plan / check；架构与判断原则见 SKILL.md。",
      "asset": "none"
    },
    {
      "id": "s13",
      "title": "数字与单位绑定不等于真实排版通过",
      "content": "05 / 中文排版必须落到成品 06 186 公里，\n不能在单位前断开。 186 公里 不断行空格已写入原生文字；中文字体角色已绑定。 真实断行、字体回退与投影可读性，须在目标 PowerPoint 检查。 来源：混排回归测试与 PPTX XML；本页 ghost 只提供结构预览。",
      "asset": "none"
    },
    {
      "id": "s14",
      "title": "保留目标软件验收",
      "content": "06 / 交付不能越过证据 07 代码可以通过。\n作品必须被看见。  下一步：打开、编辑、另存，再重开。 目标 PowerPoint 未验证 · 独立视觉盲评未开展 交付边界：结构 PASS 不等于视觉终验；没有真实评审，不填写虚构评分。",
      "asset": "none"
    },
    {
      "id": "s15",
      "title": "架构简单，判断不能简单",
      "content": "ENGINEERING × ART DIRECTION / 2026.10 01 架构简单，\n判断不能简单。  删掉重复劳动，保留真实证据。 仓库审计样稿 · 可编辑对象 · 目标 PowerPoint 尚待验收 来源：2ec0b0e 基线与本工作区改动；本文是审计展示，不是商业预测。",
      "asset": "none"
    }
  ]
}
