{"audience": "\u8463\u4e8b\u4f1a\u4e0e\u6295\u8d44\u4eba", "decision": "\u6279\u51c6 2026 \u81ea\u6709\u5185\u5bb9\u9884\u7b97", "tension": "\u6295\u653e\u6210\u672c\u4e0a\u5347\uff0c\u81ea\u6709\u5185\u5bb9\u56de\u62a5\u5468\u671f\u957f", "quality_level": "advanced", "brand_colors": ["#1A3A5C", "#C8501E"], "slides": [{"title": "\u56fe\u50cf\u7ed1\u5b9a", "content": "\u539f\u521b\u6d4b\u8bd5\u63d2\u56fe\uff0c\u4e0d\u662f\u8bc1\u8bcd", "asset": "required", "asset_role": "background", "asset_source": {"kind": "original", "path": "/home/user/ppt-visual-art-director-os/audit/reuse-e2e/reuse.png", "source": "synthetic fixture"}, "id": "a"}, {"title": "\u56fe\u50cf\u7ed1\u5b9a", "content": "\u539f\u521b\u6d4b\u8bd5\u63d2\u56fe\uff0c\u4e0d\u662f\u8bc1\u8bcd", "asset": "required", "asset_role": "background", "asset_source": {"kind": "original", "path": "/home/user/ppt-visual-art-director-os/audit/reuse-e2e/reuse.png", "source": "synthetic fixture"}, "id": "b"}]}