{
  "audience": "仓库维护者与设计作者",
  "decision": "审查本地修改后安排目标 PowerPoint 验收",
  "tension": "不能把自动测试通过误当作品视觉完成",
  "slides": [
    {
      "id": "s01",
      "title": "架构简单，判断不能简单",
      "content": "架构简单，\n判断不能简单。\n删掉重复劳动，保留真实证据。\n仓库审计样稿 · 可编辑对象 · 目标 PowerPoint 尚待验收",
      "asset": "none"
    },
    {
      "id": "s02",
      "title": "相加为100不是共同分母",
      "content": "相加为 100，\n不等于同一个整体。\n60%\n缓解率\n40%\n不良反应发生率\n同一患者可同时满足两者。先问事件是否互斥，再决定能否画饼图。",
      "asset": "none"
    },
    {
      "id": "s03",
      "title": "职责并列不是时间线",
      "content": "职责并列，\n不是先后顺序。\n青禾组\n负责\n质量测试\n澄海组\n负责\n项目交付\n没有已知上下级，就不补汇报线；没有时间轴，就不造流程。",
      "asset": "none"
    },
    {
      "id": "s04",
      "title": "新边界案例通过由7增至12",
      "content": "五个误判被消除。\n视觉质量仍需另验。\n12/12\n固定关系不变式\n不是独立盲评\n不是跨行业质量证明",
      "asset": "none"
    },
    {
      "id": "s05",
      "title": "调用链不增加模型或新模块",
      "content": "保持一条生产链。\nTHINK\nBUILD\nVERIFY\n主张与证据\n保留未知关系\n原生文字与图表\n作者决定几何\n硬门与字节凭证\n不代替视觉签署\n删除不可靠的隐式缓存；复用显式快照与已验摘要。",
      "asset": "none"
    },
    {
      "id": "s06",
      "title": "数字与单位绑定不等于真实排版通过",
      "content": "186 公里，\n不能在单位前断开。\n186 公里\n不断行空格已写入原生文字；中文字体角色已绑定。\n真实断行、字体回退与投影可读性，须在目标 PowerPoint 检查。",
      "asset": "none"
    },
    {
      "id": "s07",
      "title": "保留目标软件验收",
      "content": "代码可以通过。\n作品必须被看见。\n下一步：打开、编辑、另存，再重开。\n目标 PowerPoint 未验证 · 独立视觉盲评未开展",
      "asset": "none"
    }
  ]
}
